{
  "schema_version": "1.0.0",
  "generated_from": [
    "INDEX.json",
    "docs/**/*.md",
    "knowledge_graph/nodes/*.json"
  ],
  "docs": {
    "doc.architecture.industrial_skill_design": {
      "path": "docs/architecture/industrial_skill_design.md",
      "title": "工业级 Skill 设计 / Industrial Skill Design",
      "summary_zh": "工业级 skill 应被设计成可复用能力包，而不是提示词片段。它必须定义触发、边界、执行协议、支撑材料、证据基础、控制机制、测试资产、量化指标和生命周期。",
      "summary_en": "An industrial skill should be a reusable capability package, not a prompt fragment. It must define triggers, boundaries, execution protocol, supporting materials, evidence base, controls, test assets, metrics, and lifecycle.",
      "node_ids": [
        "pillar.design",
        "concept.skill",
        "concept.trigger",
        "concept.execution_protocol",
        "principle.progressive_disclosure",
        "principle.executable_acceptance",
        "principle.claim_evidence_traceability",
        "anti_pattern.prompted_architecture"
      ],
      "reference_ids": [
        "ref.veso.agentic_patterns",
        "ref.microsoft.agent_skills",
        "ref.anthropic.building_effective_agents",
        "ref.anthropic.writing_tools_for_agents",
        "ref.toolformer"
      ]
    },
    "doc.metrics.quantitative_skill_metrics": {
      "path": "docs/metrics/quantitative_skill_metrics.md",
      "title": "量化 Skill 指标 / Quantitative Skill Metrics",
      "summary_zh": "Skill 指标应覆盖效果、触发、稳定性、过程、成本、长度、可控性和安全。核心实践是配对评估、重复 trial、轨迹记录和成本归一化。",
      "summary_en": "Skill metrics should cover effectiveness, activation, stability, progress, cost, length, controllability, and safety. Core practices are paired eval, repeated trials, trajectory logging, and normalized cost.",
      "node_ids": [
        "pillar.metrics",
        "metric.task_success_rate",
        "metric.activation_precision",
        "metric.pass_k",
        "metric.cost_per_success",
        "metric.progress_rate",
        "metric.marginal_lift"
      ],
      "reference_ids": [
        "ref.swe_skills_bench",
        "ref.tau_bench",
        "ref.agentboard",
        "ref.helm",
        "ref.metr.long_tasks",
        "ref.agent_token_consumption",
        "ref.promptfoo.test_agent_skills",
        "ref.agent_safetybench"
      ]
    },
    "doc.operations.knowledge_base_architecture": {
      "path": "docs/operations/knowledge_base_architecture.md",
      "title": "知识库架构 / Knowledge Base Architecture",
      "summary_zh": "develop-principle 使用短入口、短图谱节点、ID 引用、长文外链和结构化引用库，目标是在多轮 agent 工业化开发中节省上下文并保持可追溯性。",
      "summary_en": "develop-principle uses short entrypoints, compact graph nodes, ID references, linked long docs, and structured references to save context and preserve traceability during multi-turn agent development.",
      "node_ids": [
        "pillar.kb_architecture",
        "principle.short_node_budget",
        "principle.id_references",
        "pattern.progressive_loading"
      ],
      "reference_ids": [
        "ref.llms_txt",
        "ref.diataxis",
        "ref.dita.topic",
        "ref.backstage.catalog",
        "ref.json_ld",
        "ref.microsoft.graphrag",
        "ref.agent_kb",
        "ref.byterover",
        "ref.docs_as_code"
      ]
    },
    "doc.operations.local_retrieval_workflow": {
      "path": "docs/operations/local_retrieval_workflow.md",
      "title": "本地检索工作流 / Local Retrieval Workflow",
      "summary_zh": "develop-principle 的本地检索流程是先用生成索引定位候选 docs、nodes、assets 和 references，再用图谱邻接关系扩展上下文，最后只加载任务相关长文和执行资产。",
      "summary_en": "develop-principle local retrieval first uses generated indexes to locate candidate docs, nodes, assets, and references; then expands through graph adjacency and loads only task-relevant long docs and execution assets.",
      "node_ids": [
        "pillar.kb_architecture",
        "principle.short_node_budget",
        "principle.id_references",
        "pattern.progressive_loading"
      ],
      "reference_ids": [
        "ref.llms_txt",
        "ref.json_ld",
        "ref.backstage.catalog",
        "ref.microsoft.graphrag",
        "ref.byterover"
      ]
    },
    "doc.operations.skill_lifecycle_governance": {
      "path": "docs/operations/skill_lifecycle_governance.md",
      "title": "Skill 生命周期治理 / Skill Lifecycle Governance",
      "summary_zh": "工业级 skill 需要生命周期治理：草稿、候选、发布、监控、回归、弃用和回滚。每个阶段都应有门禁、证据和可追溯记录。",
      "summary_en": "Industrial skills need lifecycle governance: draft, candidate, release, monitoring, regression, deprecation, and rollback. Each stage needs gates, evidence, and traceability.",
      "node_ids": [
        "pillar.lifecycle",
        "procedure.release_gate",
        "procedure.production_feedback_loop",
        "procedure.skill_deprecation"
      ],
      "reference_ids": [
        "ref.openai.practical_agents",
        "ref.owasp.agentic_skills_top10",
        "ref.slsa",
        "ref.openai.eval_best_practices",
        "ref.agent_kb",
        "ref.nist.ai_rmf"
      ]
    },
    "doc.operations.skill_lifecycle_management": {
      "path": "docs/operations/skill_lifecycle_management.md",
      "title": "Skill 生命周期管理 / Skill Lifecycle Management",
      "summary_zh": "工业级 skill 需要从草稿、候选、发布、观测、回滚、弃用到演进形成闭环。核心机制是版本清单、发布门禁、注册表、运行轨迹、回滚预案、弃用元数据和证据门控更新。",
      "summary_en": "Industrial skills need a lifecycle loop from draft, candidate, release, observation, rollback, deprecation, to evolution. Core mechanisms are version manifests, release gates, registries, runtime traces, rollback plans, deprecation metadata, and evidence-gated updates.",
      "node_ids": [
        "pillar.lifecycle",
        "concept.skill_release_manifest",
        "procedure.release_gate",
        "procedure.rollback_plan",
        "procedure.deprecation_policy",
        "procedure.evidence_gated_update",
        "pattern.skill_registry",
        "metric.rollback_readiness",
        "metric.lifecycle_trace_coverage"
      ],
      "reference_ids": [
        "ref.open_agent_skills.specification",
        "ref.skills_re.registry",
        "ref.skillsvote.lifecycle_governance",
        "ref.skilldex.package_registry",
        "ref.secure_agent_skills.lifecycle_threats",
        "ref.opentelemetry.genai_agent_spans",
        "ref.openai.agents_tracing",
        "ref.langsmith.observability",
        "ref.semver",
        "ref.google_sre.canarying",
        "ref.openfeature.feature_flags"
      ]
    },
    "doc.research.evidence_driven_skill_research": {
      "path": "docs/research/evidence_driven_skill_research.md",
      "title": "证据驱动的 Skill 资料搜集 / Evidence-Driven Skill Research",
      "summary_zh": "依赖外部事实的 skill 必须先做可控广度和深度的资料搜集：建立来源花名册、多角度 fan-out、迭代深化、可靠性分级、三角验证，最后让每条结论可溯源到证据 id。",
      "summary_en": "A fact-dependent skill must first run breadth- and depth-controlled research: build a source roster, fan out across angles, iteratively deepen, grade reliability, triangulate, and make every conclusion trace to an evidence id.",
      "node_ids": [
        "pillar.research",
        "procedure.source_roster",
        "procedure.search_fan_out",
        "procedure.iterative_deepening",
        "procedure.source_reliability_grading",
        "procedure.triangulation",
        "principle.claim_evidence_traceability",
        "metric.source_coverage",
        "metric.claim_traceability_rate"
      ],
      "reference_ids": [
        "ref.prisma.2020",
        "ref.cochrane.handbook",
        "ref.grade.working_group",
        "ref.nato.admiralty_code",
        "ref.caulfield.sift",
        "ref.unaids.triangulation",
        "ref.w3c.prov_overview",
        "ref.arxiv.self_rag",
        "ref.arxiv.deeprag",
        "ref.arxiv.agentic_rag_survey",
        "ref.arxiv.question_decomp_rag",
        "ref.arxiv.deepwidesearch",
        "ref.arxiv.claimaudit",
        "ref.pirolli.information_foraging"
      ]
    },
    "doc.research.skill_engineering_reading_list": {
      "path": "docs/research/skill_engineering_reading_list.md",
      "title": "Skill 工程扩展阅读 / Skill Engineering Reading List",
      "summary_zh": "skill 设计、测试和 TDD 的扩展参考文献，按主题注解；用于深化触发、工具规范、评估、轨迹/变异/契约测试和可靠性的设计。",
      "summary_en": "Annotated extended references for skill design, testing, and TDD; deepens triggers, tool specs, evaluation, trajectory/mutation/contract testing, and reliability.",
      "node_ids": [
        "pillar.design"
      ],
      "reference_ids": [
        "ref.sok.agentic_skills",
        "ref.skillsbench",
        "ref.anthropic.context_engineering",
        "ref.anthropic.advanced_tool_use",
        "ref.openai.gpt41_prompting_guide",
        "ref.microsoft.sk_plugins",
        "ref.edd_ops",
        "ref.adarubric",
        "ref.prometheus2",
        "ref.gaming_the_judge",
        "ref.agentassay",
        "ref.hal.holistic_agent_leaderboard",
        "ref.harness_bench",
        "ref.trace.trajectory_eval",
        "ref.tool_registry_design",
        "ref.semantic_invariance_agents",
        "ref.osworld",
        "ref.webarena",
        "ref.healthbench",
        "ref.mutation_guided_test_meta"
      ]
    },
    "doc.research.skill_ops_reading_list": {
      "path": "docs/research/skill_ops_reading_list.md",
      "title": "Skill 运维与治理扩展阅读 / Skill Ops and Governance Reading List",
      "summary_zh": "skill 量化指标、可观测性、生命周期/发布、治理安全与上下文记忆的扩展参考文献，按主题注解。",
      "summary_en": "Annotated extended references for skill metrics, observability, lifecycle/release, governance/security, and context/memory.",
      "node_ids": [
        "pillar.metrics"
      ],
      "reference_ids": [
        "ref.otel.genai_spans",
        "ref.reliability_bench",
        "ref.beyond_pass1",
        "ref.clear_framework",
        "ref.eval_stat_guarantees",
        "ref.efficient_bench_agents",
        "ref.agent_eval_survey",
        "ref.sigstore",
        "ref.nist_ai_rmf_genai",
        "ref.asb_iclr2025",
        "ref.seagent_mac",
        "ref.eu_ai_act",
        "ref.securing_agentic_ai",
        "ref.memgpt",
        "ref.memory_survey_2026",